{
  "schema_version": "resolution/1.0",
  "registry_sha256": "eeeeeeeeeeeeeeeeeeeeeeeeeeeeeeeeeeeeeeeeeeeeeeeeeeeeeeeeeeeeeeee",
  "notebook": "bridgeland-stability",
  "corpus_version": 5048,
  "corpus_manifest_content_hash": "1111111111111111111111111111111111111111111111111111111111111111",
  "resolver_version": "arxmcp/statement_resolve.py@1.0.0",
  "chunker_version": "chunker/2.3.0",
  "generated_at": "2026-08-04T08:55:10Z",
  "results": [
    {
      "key": "stmt:9f4c1a20b7d3:bridgeland2007.lem-8.2",
      "resolution": "current",
      "matched_by": "quote_sha256",
      "chunk_id": "arxiv:math/0212237:a82c3230040fd724",
      "resolved_source_version": null,
      "matched_body_sha256": "ebacfe5caa6c1df8229ec6bfbcf55f855a524a77cf78a9fb3171b81172d6f50d",
      "printed_number": "8.2",
      "similarity": null,
      "reason": null
    },
    {
      "key": "stmt:9f4c1a20b7d3:bridgeland2007.obl-stab-action",
      "resolution": "not_run",
      "matched_by": "none",
      "chunk_id": null,
      "resolved_source_version": null,
      "matched_body_sha256": null,
      "printed_number": null,
      "similarity": null,
      "reason": "kind==obligation and quote_sha256 is null; nothing to resolve"
    },
    {
      "key": "stmt:9f4c1a20b7d3:bridgeland2007.lem-8.3",
      "resolution": "current",
      "matched_by": "quote_containment",
      "chunk_id": "arxiv:math/0212237:a82c3230040fd724",
      "resolved_source_version": null,
      "matched_body_sha256": "ebacfe5caa6c1df8229ec6bfbcf55f855a524a77cf78a9fb3171b81172d6f50d",
      "printed_number": "8.2",
      "similarity": null,
      "reason": "The chunker merged this statement's chunk with the following one; the quote is still present, so this is current by containment rather than by byte-equality."
    },
    {
      "key": "stmt:9f4c1a20b7d3:bridgeland2007.def-1.1",
      "resolution": "not_applicable",
      "matched_by": "quote_sha256",
      "chunk_id": "arxiv:math/0212237:5f1b90c2e6a4118d",
      "resolved_source_version": null,
      "matched_body_sha256": "ebacfe5caa6c1df8229ec6bfbcf55f855a524a77cf78a9fb3171b81172d6f50d",
      "printed_number": "1.1",
      "similarity": null,
      "reason": "The quote is byte-equal to a chunk of this paper, but the entry declares source.version v3 and documents.arxiv_version is '' for every row of this notebook. Calling that `current` would assert a v3 pin confirmed by bytes of unknown version."
    },
    {
      "key": "stmt:9f4c1a20b7d3:bridgeland2007.def-3.3",
      "resolution": "not_applicable",
      "matched_by": "quote_containment",
      "chunk_id": "arxiv:math/0212237:c07a41ff2b93d5e8",
      "resolved_source_version": null,
      "matched_body_sha256": "ebacfe5caa6c1df8229ec6bfbcf55f855a524a77cf78a9fb3171b81172d6f50d",
      "printed_number": "3.3",
      "similarity": null,
      "reason": "Found by containment after a re-chunk merged this statement's chunk -- and withheld for the same reason the byte-equal match above is: the corpus cannot name the arXiv version it holds. The version guard is orthogonal to which rung found the quote."
    }
  ],
  "counts": {
    "current": 2,
    "drifted": 0,
    "unresolvable": 0,
    "paper_absent": 0,
    "not_run": 1,
    "not_applicable": 2
  }
}
